{
  "version": "0.1.0",
  "contributors": ["TheAncientOwl"],
  "title": "Without You",
  "artists": ["The Kid LAROI"],
  "type": ["acoustic"],
  "notes": [],
  "capo": 0,
  "chordIDs": ["Am", "Fmaj7", "C", "G", "E"],
  "songSegments": {
    "intro": {
      "name": "intro",
      "type": "chords",
      "patterns": [
        {
          "times": 1,
          "segments": [
            {
              "chordIDs": ["-"],
              "chordTimes": 1,
              "strummingPattern": ["Dx", "-", "Dx", "-", "Dx", "-", "Dx", "Ux"]
            }
          ]
        },
        {
          "times": 1,
          "segments": [
            {
              "chordIDs": ["Am", "Fmaj7", "C", "G"],
              "chordTimes": 1,
              "strummingPattern": [
                "D",
                "-",
                "-",
                "-",
                "D",
                "-",
                "-",
                "U",
                "-",
                "U",
                "D",
                "-",
                "D",
                "-",
                "D",
                "U"
              ]
            }
          ]
        }
      ]
    },
    "chorus1": {
      "name": "chorus",
      "type": "chords",
      "patterns": [
        {
          "times": 2,
          "segments": [
            {
              "chordIDs": ["Am", "Fmaj7", "C", "G"],
              "chordTimes": 1,
              "strummingPattern": [
                "D",
                "-",
                "-",
                "-",
                "D",
                "-",
                "-",
                "U",
                "-",
                "U",
                "D",
                "-",
                "D",
                "-",
                "D",
                "U"
              ]
            }
          ]
        }
      ]
    },
    "verse": {
      "name": "verse",
      "type": "chords",
      "patterns": [
        {
          "times": 2,
          "segments": [
            {
              "chordIDs": ["Am", "Fmaj7", "C", "G"],
              "chordTimes": 1,
              "strummingPattern": [
                "D",
                "-",
                "-",
                "-",
                "D",
                "-",
                "-",
                "U",
                "-",
                "U",
                "D",
                "-",
                "D",
                "-",
                "D",
                "U"
              ]
            }
          ]
        }
      ]
    },
    "pre-chorus1": {
      "name": "pre-chorus 1",
      "type": "chords",
      "patterns": [
        {
          "times": 1,
          "segments": [
            {
              "chordIDs": ["Am", "Fmaj7", "C"],
              "chordTimes": 1,
              "strummingPattern": [
                "D",
                "-",
                "-",
                "-",
                "D",
                "-",
                "-",
                "U",
                "-",
                "U",
                "D",
                "-",
                "D",
                "-",
                "D",
                "U"
              ]
            }
          ]
        },
        {
          "times": 1,
          "segments": [
            {
              "chordIDs": ["E"],
              "chordTimes": 1,
              "strummingPattern": [
                "D",
                "-",
                "D",
                "-",
                "D",
                "-",
                "D",
                "-",
                "D",
                "-",
                "-",
                "-",
                "Dx",
                "Ux",
                "Dx",
                "Ux"
              ]
            }
          ]
        }
      ]
    },
    "chorus2": {
      "name": "chorus",
      "type": "chords",
      "patterns": [
        {
          "times": 4,
          "segments": [
            {
              "chordIDs": ["Am", "Fmaj7", "C", "G"],
              "chordTimes": 1,
              "strummingPattern": [
                "D",
                "-",
                "-",
                "-",
                "D",
                "-",
                "-",
                "U",
                "-",
                "U",
                "D",
                "-",
                "D",
                "-",
                "D",
                "U"
              ]
            }
          ]
        }
      ]
    },
    "bridge": {
      "name": "bridge",
      "type": "chords",
      "patterns": [
        {
          "times": 1,
          "segments": [
            {
              "chordIDs": ["Am", "Fmaj7", "C"],
              "chordTimes": 1,
              "strummingPattern": ["D"]
            }
          ]
        },
        {
          "times": 1,
          "segments": [
            {
              "chordIDs": ["G"],
              "chordTimes": 1,
              "strummingPattern": [
                "D",
                "-",
                "D",
                "-",
                "D",
                "-",
                "D",
                "-",
                "D",
                "-",
                "D",
                "-",
                "D",
                "-",
                "D",
                "U"
              ]
            }
          ]
        }
      ]
    },
    "pre-chorus2": {
      "name": "pre-chorus 2",
      "type": "chords",
      "patterns": [
        {
          "times": 1,
          "segments": [
            {
              "chordIDs": ["Am", "Fmaj7", "C"],
              "chordTimes": 1,
              "strummingPattern": [
                "D",
                "-",
                "-",
                "-",
                "D",
                "-",
                "-",
                "U",
                "-",
                "U",
                "D",
                "-",
                "D",
                "-",
                "D",
                "U"
              ]
            }
          ]
        },
        {
          "times": 1,
          "segments": [
            {
              "chordIDs": ["-"],
              "chordTimes": 1,
              "strummingPattern": [
                "-",
                "-",
                "-",
                "-",
                "-",
                "-",
                "-",
                "-",
                "-",
                "-",
                "-",
                "-",
                "Dx",
                "Ux",
                "Dx",
                "Ux"
              ]
            }
          ]
        }
      ]
    },
    "outro": {
      "name": "outro",
      "type": "chords",
      "patterns": [
        {
          "times": 1,
          "segments": [
            {
              "chordIDs": ["Am", "Fmaj7", "C", "G"],
              "chordTimes": 1,
              "strummingPattern": ["D"]
            }
          ]
        }
      ]
    }
  },
  "songSegmentsOrder": [
    "intro",
    "chorus1",
    "verse",
    "pre-chorus1",
    "chorus2",
    "bridge",
    "pre-chorus2",
    "chorus1",
    "outro"
  ],
  "resources": [
    {
      "alias": "Without You Guitar Tutorial The Kid LAROI Lesson |Easy Chords + Cover|",
      "author": "GuitarZero2Hero ~ YouTube",
      "link": "https://youtu.be/I8UfGA0qR7A"
    },
    {
      "alias": "Without You Guitar Cover The Kid LAROI ðŸŽ¸|Tabs + Chords|",
      "author": "GuitarZero2Hero Express ~ YouTube",
      "link": "https://youtu.be/ayhT2swtB0w"
    }
  ]
}
