{
  "version": "0.1.1",
  "contributors": ["TheAncientOwl"],
  "title": "Never Gonna Give You Up",
  "artists": ["Rick Astley"],
  "type": ["acoustic"],
  "notes": ["Last chorus Em & Am only one down strum"],
  "capo": 1,
  "chordIDs": ["Fmaj7", "G", "Em", "Am"],
  "songSegments": {
    "intro": {
      "name": "intro",
      "type": "chords",
      "times": 4,
      "patterns": [
        {
          "times": 1,
          "segments": [
            {
              "chordIDs": ["Fmaj7"],
              "chordTimes": 1,
              "strummingPattern": ["D", "-", "U", "D"]
            },
            {
              "chordIDs": ["G"],
              "chordTimes": 1,
              "strummingPattern": ["D", "-", "U", "D", "D", "D", "U"]
            }
          ]
        },
        {
          "times": 1,
          "segments": [
            {
              "chordIDs": ["Em"],
              "chordTimes": 1,
              "strummingPattern": ["D", "-", "U", "D"]
            },
            {
              "chordIDs": ["Am"],
              "chordTimes": 1,
              "strummingPattern": ["D", "-", "U", "D", "D", "D", "U"]
            }
          ]
        }
      ]
    },
    "verse": {
      "name": "verse",
      "type": "chords",
      "times": 1,
      "patterns": [
        {
          "times": 4,
          "segments": [
            {
              "chordIDs": ["Fmaj7", "G"],
              "chordTimes": 1,
              "strummingPattern": ["D", "-", "U", "D", "-", "D", "-", "U", "D", "D", "D", "U"]
            }
          ]
        }
      ]
    },
    "pre-chorus": {
      "name": "pre-chorus",
      "type": "chords",
      "times": 1,
      "patterns": [
        {
          "times": 1,
          "segments": [
            {
              "chordIDs": ["Fmaj7", "G"],
              "chordTimes": 1,
              "strummingPattern": ["D", "-", "U", "D", "-", "D", "-", "U", "D", "D", "D", "U"]
            }
          ]
        }
      ]
    },
    "chorus": {
      "name": "chorus",
      "type": "chords",
      "times": 4,
      "patterns": [
        {
          "times": 1,
          "segments": [
            {
              "chordIDs": ["Fmaj7"],
              "chordTimes": 1,
              "strummingPattern": ["D", "-", "U", "D"]
            },
            {
              "chordIDs": ["G"],
              "chordTimes": 1,
              "strummingPattern": ["D", "-", "U", "D", "D", "D", "U"]
            }
          ]
        },
        {
          "times": 1,
          "segments": [
            {
              "chordIDs": ["Em"],
              "chordTimes": 1,
              "strummingPattern": ["D", "-", "U", "D"]
            },
            {
              "chordIDs": ["Am"],
              "chordTimes": 1,
              "strummingPattern": ["D", "-", "U", "D", "D", "D", "U"]
            }
          ]
        }
      ]
    }
  },
  "songSegmentsOrder": ["intro", "verse", "pre-chorus", "chorus", "pre-chorus", "chorus"],
  "resources": [
    {
      "alias": "Rick Astley - Never Gonna Give You Up EASY Guitar Tutorial With Chords / Lyrics",
      "author": "Easy 2 Play Music ~ YouTube",
      "link": "https://youtu.be/iA4mbi7W_xQ"
    },
    {
      "alias": "Never Gonna Give You Up by Rick Astley Guitar Tutorial Lesson!",
      "author": "Chevans Music ~ YouTube",
      "link": "https://www.youtube.com/shorts/EwtfzXa-9k8?feature=share"
    }
  ]
}
