{
  "version": "0.1.0",
  "contributors": ["TheAncientOwl"],
  "title": "Sweater Weather",
  "artists": ["The Neighbourhood"],
  "type": ["acoustic"],
  "notes": [],
  "capo": 3,
  "chordIDs": ["C", "Am", "Em", "G", "D"],
  "songSegments": {
    "verse": {
      "name": "verse",
      "type": "chords",
      "patterns": [
        {
          "times": 4,
          "segments": [
            {
              "chordIDs": ["C", "Am", "Em"],
              "chordTimes": 1,
              "strummingPattern": ["D", "-", "D", "U", "-", "U", "D", "U"]
            },
            {
              "chordIDs": ["Am", "G"],
              "chordTimes": 1,
              "strummingPattern": ["D", "-", "D", "U"]
            }
          ]
        }
      ]
    },
    "pre-chorus": {
      "name": "pre-chorus",
      "type": "chords",
      "patterns": [
        {
          "times": 2,
          "segments": [
            {
              "chordIDs": ["C", "Am", "Em", "G"],
              "chordTimes": 1,
              "strummingPattern": ["D", "-", "D", "U", "-", "U", "D", "U"]
            }
          ]
        }
      ]
    },
    "chorus": {
      "name": "chorus",
      "type": "chords",
      "patterns": [
        {
          "times": 3,
          "segments": [
            {
              "chordIDs": ["C", "Am", "Em", "G"],
              "chordTimes": 1,
              "strummingPattern": ["D"]
            }
          ]
        }
      ]
    },
    "chorus2": {
      "name": "chorus 2",
      "type": "chords",
      "patterns": [
        {
          "times": 4,
          "segments": [
            {
              "chordIDs": ["C", "Am", "Em", "G"],
              "chordTimes": 1,
              "strummingPattern": ["D"]
            }
          ]
        },
        {
          "times": 1,
          "segments": [
            {
              "chordIDs": ["D"],
              "chordTimes": 1,
              "strummingPattern": ["D"]
            }
          ]
        }
      ]
    },
    "bridge": {
      "name": "bridge",
      "type": "chords",
      "patterns": [
        {
          "times": 2,
          "segments": [
            {
              "chordIDs": ["Am", "G", "D", "D"],
              "chordTimes": 1,
              "strummingPattern": ["D", "-", "D", "-", "-", "U", "D", "U"]
            }
          ]
        },
        {
          "times": 4,
          "segments": [
            {
              "chordIDs": ["Am", "G", "D", "D"],
              "chordTimes": 1,
              "strummingPattern": ["D", "-", "D", "-", "-", "U", "D", "U"]
            }
          ]
        }
      ]
    },
    "chorus3": {
      "name": "chorus 3",
      "type": "chords",
      "patterns": [
        {
          "times": 4,
          "segments": [
            {
              "chordIDs": ["C", "Am", "Em", "G"],
              "chordTimes": 1,
              "strummingPattern": ["D", "-", "D", "-", "D", "U", "D", "U"]
            }
          ]
        }
      ]
    },
    "fade": {
      "name": "fade",
      "type": "chords",
      "patterns": [
        {
          "times": 4,
          "segments": [
            {
              "chordIDs": ["C", "Am", "Em", "G"],
              "chordTimes": 1,
              "strummingPattern": ["D"]
            }
          ]
        }
      ]
    }
  },
  "songSegmentsOrder": [
    "verse",
    "pre-chorus",
    "chorus",
    "verse",
    "pre-chorus",
    "chorus2",
    "bridge",
    "chorus3",
    "fade"
  ],
  "resources": [
    {
      "alias": "Sweater Weather Guitar Tutorial - The Neighbourhood Guitar Lesson |Chords + Guitar Cover|",
      "author": "GuitarZero2Hero ~ YouTube",
      "link": "https://www.youtube.com/watch?v=kvGorssKuO8"
    },
    {
      "alias": "Sweater Weather Guitar Cover Acoustic - The Neighborhood + Onscreen Chords",
      "author": "GuitarZero2Hero Express ~ YouTube",
      "link": "https://youtu.be/HcCzuFIOKFw"
    }
  ]
}
